{
  "schema_version": "1.0",
  "setup_id": "CME_MINI_ES1_5_20260705T134500Z_12345",
  "source": "tradingview_pine",
  "symbol": "CME_MINI:ES1!",
  "root_symbol": "ES",
  "companion_symbol": "CME_MINI:NQ1!",
  "timeframe": "5",
  "bar_time": "2026-07-05T13:45:00Z",
  "bar_index": 12345,
  "direction": "BULLISH",
  "rule_score": 80,
  "price": 6721.25,
  "entry": {
    "zone_type": "FVG",
    "low": 6720.5,
    "high": 6722.0,
    "preferred": 6721.25
  },
  "risk": {
    "stop_loss": 6714.75,
    "take_profit_1": 6734.25,
    "risk_reward": 2.0,
    "risk_points": 6.5,
    "reward_points": 13.0
  },
  "features": {
    "bos": {
      "state": "BULLISH",
      "level": 6720.0
    },
    "fvg": {
      "state": "BULLISH",
      "low": 6720.5,
      "high": 6722.0,
      "age_bars": 3
    },
    "order_block": {
      "state": "NONE",
      "low": null,
      "high": null,
      "age_bars": null
    },
    "liquidity_sweep": {
      "state": "BULLISH",
      "level": 6716.0,
      "pool_type": "ASIA_LOW",
      "age_bars": 6
    },
    "smt": {
      "state": "BULLISH",
      "lookback": 20
    },
    "volume": {
      "rvol": 1.62,
      "state": "STRONG"
    },
    "consolidation": {
      "active": false,
      "directional_efficiency": 0.48,
      "range_atr_multiple": 2.8
    },
    "htf_bias": "BULLISH",
    "displacement": "BULLISH"
  },
  "session": {
    "name": "NY_AM",
    "current_high": 6726.75,
    "current_low": 6716.0,
    "completed_high": 6724.0,
    "completed_low": 6716.0
  },
  "diagnostics": {
    "atr": 5.25,
    "mintick": 0.25,
    "notes": "Example payload"
  }
}